{
  "version": "0.4.0",
  "exported_at": "2026-03-18T12:15:00Z",
  "count": 1,
  "items": [
    {
      "id": "11111111-1111-1111-1111-111111111111",
      "title": "Use Spotify Web API for stage playlist orchestration",
      "status": "verified",
      "trust_level": "validated",
      "checksum": "sha256-memory-checksum"
    }
  ]
}
