{
  "version": "0.4.0",
  "exported_at": "2026-03-18T10:00:00Z",
  "count": 2,
  "items": [
    {
      "id": "11111111-1111-1111-1111-111111111111",
      "title": "Use Spotify Web API",
      "status": "verified",
      "trust_level": "validated",
      "checksum": "sha256checksum1"
    },
    {
      "id": "22222222-2222-2222-2222-222222222222",
      "title": "Rate limit workaround",
      "status": "active",
      "trust_level": "inferred",
      "checksum": "sha256checksum2"
    }
  ]
}
